{
  "$id": "https://appsdk.local/contracts/records/worktree-record.schema.json",
  "$schema": "https://json-schema.org/draft/2020-12/schema",
  "allOf": [
    {
      "if": {
        "properties": {
          "issue_id": {
            "minLength": 1,
            "not": {
              "pattern": "^(?:none$|legacy-)"
            },
            "type": "string"
          }
        },
        "required": [
          "issue_id"
        ]
      },
      "then": {
        "required": [
          "bug_triage",
          "bug_triage_query_binding"
        ]
      }
    }
  ],
  "properties": {
    "base_commit": {
      "type": "string"
    },
    "base_ref": {
      "type": "string"
    },
    "branch": {
      "type": "string"
    },
    "bug_triage": {
      "properties": {
        "mode": {
          "enum": [
            "new_confirmed",
            "reopened",
            "historical_legacy"
          ]
        },
        "query": {
          "minLength": 1,
          "type": "string"
        },
        "query_executed": {
          "const": true
        },
        "reopened_from_issue_id": {
          "type": [
            "string",
            "null"
          ]
        }
      },
      "required": [
        "query_executed",
        "query",
        "mode",
        "reopened_from_issue_id"
      ],
      "type": "object"
    },
    "bug_triage_query_binding": {
      "pattern": "^sha256:[a-f0-9]{64}$",
      "type": "string"
    },
    "created_at": {
      "type": "string"
    },
    "final_clean": {
      "const": true
    },
    "goal_issue_binding": {
      "pattern": "^sha256:[a-f0-9]{64}$",
      "type": "string"
    },
    "goal_issue_id": {
      "type": "string"
    },
    "head_commit": {
      "type": "string"
    },
    "initial_clean": {
      "const": true
    },
    "isolation_mode": {
      "const": "isolated_worktree"
    },
    "issue_id": {
      "type": "string"
    },
    "milestone_id": {
      "type": "string"
    },
    "module_id": {
      "type": "string"
    },
    "scope_hash": {
      "type": "string"
    },
    "worktree_id": {
      "type": "string"
    }
  },
  "required": [
    "worktree_id",
    "issue_id",
    "module_id",
    "base_ref",
    "base_commit",
    "branch",
    "head_commit",
    "initial_clean",
    "final_clean",
    "isolation_mode",
    "scope_hash",
    "created_at"
  ],
  "type": "object"
}
