{
  "$schema": "https://appsdk.local/contracts/records/worktree-record.schema.json",
  "worktree_id": "WT-20260817-ZARCHV2-ACTIVEV4-CLOSEOUT-001",
  "issue_id": "zterm-runtime-architecture-v2",
  "module_id": "zterm-runtime-v2",
  "base_ref": "main",
  "base_commit": "91f69b2a36f00e075a87a35e66879bb7ebd88271",
  "branch": "work/appsdk-active-v4-closeout-20260817T022328Z",
  "head_commit": "c11485f9c72d3a59f548f2ef90824ef727e9be7b",
  "initial_clean": true,
  "final_clean": true,
  "isolation_mode": "isolated_worktree",
  "scope_hash": "sha256:ad06d8f40b865c3b89440b0b0049a7c4a87ae9538a2163f98edf18903f31ac21",
  "created_at": "2026-08-17T02:23:28Z"
}
