{
  "$schema": "https://appsdk.local/contracts/records/worktree-record.schema.json",
  "worktree_id": "WT-20260817-ZARCHV2-ACTIVEV4-MAIN-CLOSEOUT-001",
  "issue_id": "zterm-runtime-architecture-v2",
  "module_id": "client.daemon_connection",
  "base_ref": "main",
  "base_commit": "b941affb7c89021bb5662a7686fc52847a639e6c",
  "branch": "work/appsdk-active-v4-main-closeout-20260817T184155Z",
  "head_commit": "d06a9b889f38c0ac5d4670791561b5b6f2114708",
  "initial_clean": true,
  "final_clean": true,
  "isolation_mode": "isolated_worktree",
  "scope_hash": "sha256:e939fc3be8c64425b047abeb47a1c108890be6427825360f742cb7b44edb9790",
  "created_at": "2026-08-17T18:41:55Z"
}
